,title,ups,selftext,num_comments,subreddit
0,F.C.C. Announces Plan to Repeal Net Neutrality,146294,,3018,Futurology
1,"A Hawaiian Politician Is Introducing a Bill That Would Encourage Creation of Locally Owned Broadband Networks: ""One option is to reject corporate internet service providers altogether, and control the internet ourselves.""",85236,,2664,Futurology
2,"This Scientist Wants to Bring Star Trek Values to Congress - “one of a growing number of scientists who are running for public office... too many elected officials are ignorant of basic science, and that the only solution is for scientists to get in there and do a better job.”",79524,,2919,Futurology
3,"Stephen Hawking leaves behind 'breathtaking' final multiverse theory - A final theory explaining how mankind might detect parallel universes was completed by Stephen Hawking shortly before he died, it has emerged.",77256,,3272,Futurology
4,"Snowden: We are becoming too dependent on Facebook as a news source; ""To have one company that has enough power to reshape the way we think, I don’t think I need to describe how dangerous that is""",74203,,4813,Futurology
5,"Elon Musk Says Humans Should Already Have A Moon Base: “It’s 2017,” Musk said. “We should have a lunar base by now. What the hell’s going on?”",71659,,5309,Futurology
6,The U.K. Just Went 55 Hours Without Using Coal for the First Time in History,70874,,1884,Futurology
7,"After beating cable lobby, Colorado city moves ahead with muni broadband - Fort Collins plans universal broadband, net neutrality, and gigabit speeds.",70772,,3019,Futurology
8,"In wake of net neutrality decision, should cities build internet networks? Many cities seeking to offer cheap service to the community, despite telecom industry pushback",67538,,3226,Futurology
9,"Librarians are in uproar after an article in Forbes magazine proposed replacing all public libraries in the US with Amazon bookstores, which said libraries ‘don’t have the same value they used to’ and cost taxpayers too much",67355,,5402,Futurology
10,A Chinese company is offering free training for US coal miners to become wind farmers,65911,,2764,Futurology
11,Google is officially 100% sun and wind powered – 3.0 gigawatts worth,65573,,1678,Futurology
12,"Elon Musk explains why he launched a car toward Mars — and the reasons are much bigger than his ego: “The goal of this was to inspire you, and make you believe again, just as people believed in the Apollo era, that anything is possible.”",61597,,2668,Futurology
13,Google’s New Earbuds Can Translate 40 Languages Instantly in Your Ear,60029,,3403,Futurology
14,"Gen Z teenagers have begun quitting social media in droves refusing to be programmed by it, playing the game of ""who can appear the happiest""",59730,,4411,Futurology
15,The European Union has rejected Donald Trump’s offer to renegotiate the Paris climate agreement and pledged instead to bypass Washington to work with US business leaders and state governors to implement the historic accord’s commitments.,59438,,5366,Futurology
16,"Facebook and Apple urge Donald Trump not to pull out of Paris Agreement: Twenty-five US companies including Apple, Facebook and Google have signed a letter imploring Mr Trump not to exit the 2015 Paris climate accord",58362,,6858,Futurology
17,The United States just quietly switched on 179 megawatts of solar power generators in Nevada,58059,,2480,Futurology
18,"Bill Gates, Jeff Bezos, Jack Ma, and other investors worth $170 billion are launching a clean-energy fund to fight climate change",57854,,3316,Futurology
19,"Donald Trump urged to ditch his climate change denial by 630 major firms who warn it 'puts American prosperity at risk' - ""We want the US economy to be energy efficient and powered by low-carbon energy""",56563,,5365,Futurology
20,US administration lifts ban on pesticides linked to declining bee numbers - Environmentalists say lifting the restriction poses a grave threat to pollinating insects,55825,,3330,Futurology
21,Elon Musk: 'We want a new space race — space races are exciting',54275,,2364,Futurology
22,Bill Gates calls GMOs 'perfectly healthy' — and scientists say he's right. Gates also said he sees the breeding technique as an important tool in the fight to end world hunger and malnutrition.,53820,,4991,Futurology
23,Fast-food CEO says 'it just makes sense' to consider replacing cashiers with machines as minimum wages rise,53694,,11511,Futurology
24,Bill Gates buys big chunk of land in Arizona to build 'smart city',53290,,3800,Futurology
25,"If data is the new oil, are tech companies robbing us blind? Lanier suggests that users should receive a micropayment every time their data is used to earn a company money.",52896,,2244,Futurology
26,"Lab meat to transform meat industry in 2021 - “This 'clean meat' company says it has already produced beef, chicken and duck directly from animal cells, without the need to raise and slaughter animals.”",52087,,5275,Futurology
27,"The right to disconnect: The new laws banning after-hours work emails - Around the world, several governments have begun to go as far as legislate laws allowing employees the freedom to not have to engage with work outside of official work hours.",51812,,3511,Futurology
28,68 mayors adopt Paris climate accord after U.S. pulls out - “The world cannot wait—and neither will we”,51713,,5276,Futurology
29,"The world's first vaccine against malaria will be introduced in three countries - Ghana, Kenya and Malawi - starting in 2018.",50160,,2563,Futurology
30,"In 2013 it cost $330,000 to grow a hamburger in the lab. They're soon expected to sell for $11.",49668,,3915,Futurology
31,CRISPR kills HIV and eats Zika 'like Pac-man'. Its next target? Cancer,49208,,1889,Futurology
32,Elon Musk's South Australian battery responded in just 140 milliseconds after a coal-fired power plant failed,48775,,1506,Futurology
33,Germany’s War on Coal Is Over. Coal Lost. Its last mine is about to close.,48501,,1736,Futurology
34,Bill Gates: the robot that takes your job should pay taxes,48463,,6066,Futurology
35,"Naked mole rats defy the biological law of aging - They rarely get cancer, are resistant to some types of pain, and can survive up to 18 minutes without oxygen. But perhaps their greatest feat, a new paper suggests, is that they don't age. Naked mole-rat mortality rates do not increase with age.",48352,,2474,Futurology
36,All eyes on Canada as first G7 nation prepares to make marijuana legal,48122,,3166,Futurology
37,Massachusetts lawmakers float aggressive bill mandating 100% renewables by 2035,47689,,2788,Futurology
38,"Kimbal Musk — Elon’s brother — is leading a $25 million mission to fix food in schools across the US: “in 300 public schools in American cities. Part-playground, part-outdoor classroom, the learning gardens serve as spaces where students learn about the science of growing fruits and veggies“",47538,,1355,Futurology
39,"Richard Branson: ""I believe that in 30 years or so we will no longer need to kill any animals and that all meat will either be clean or plant-based, taste the same and also be much healthier for everyone.""",47501,,5787,Futurology
40,Costa Rica Becomes the First Nation to Ban Fossil Fuels,46580,,1192,Futurology
41,"Elon Musk making “kid-sized submarine” to rescue teens in Thailand cave: ""Construction complete in about 8 hours,"" the tech billionaire tweeted Saturday.",46353,,3614,Futurology
42,Norway to spend $13 million to upgrade 'doomsday' Arctic seed vault,45720,,1011,Futurology
43,"France to shut all coal-fired power stations by 2021, Macron declares",45291,,1304,Futurology
44,The biggest ocean cleanup in history launches in less than 2 weeks,44739,,906,Futurology
45,"Re:scam | AI email program designed to reply to email scammers. When you forward a scam to the bot, it adopts personas to engage the scammers and waste their time",44339,,1390,Futurology
46,"Lab-grown 'clean' meat could be on sale by end of 2018, says producer - Cultured tissue, harvested without killing any animals, could allow scientists to grown meals’ worth of products with just a handful of starter cells",44108,,5990,Futurology
47,"Tesla battery degradation at less than 10% after over 160,000 miles, according to latest data",43862,,1708,Futurology
48,"Scientists have succeeded in combining spider silk with graphene and carbon nanotubes, a composite material five times stronger that can hold a human, which is produced by the spider itself after it drinks water containing the nanotubes.",43708,,2558,Futurology
49,New study reveals we are at the brink of starting a domino effect of adverse ecological phenomena that will make it almost impossible to control climate change.,43488,,5851,Futurology
50,Germany Breaks A Solar Record — Gets 85% Of Electricity From Renewables,43480,,1820,Futurology
51,"A plant 1,000 times more efficient at CO2 removal than photosynthesis is now active. The world's first commercial carbon capture plant is now online in Switzerland.",43408,,2202,Futurology
52,"Canada sets universal broadband goal of 50Mbps and unlimited data for all: regulator declares Internet ""a basic telecommunications service for all Canadians""",43309,,2663,Futurology
53,"The city of Las Vegas is now drawing 100 percent of its power from renewable energy sources, a goal officials have been working toward for the better part of a decade.",43285,,1481,Futurology
54,"Boeing: We are going to beat SpaceX to Mars - Elon Musk: ""Do it.""",43274,,1902,Futurology
55,"480,464 citizens of Arizona have signed a state initiative to create a state constitutional amendment that would require 50% of electricity to come from renewable sources by 2030.",43064,,1292,Futurology
56,McDonald's Becomes the First Restaurant Company to Set Approved Science Based Target to Reduce Greenhouse Gas Emissions - “by 2030. This is the equivalent of taking 32 million passenger cars off the road for an entire year or planting 3.8 billion trees and growing them for 10 years.”,42739,,2197,Futurology
57,The University of Hawaii Will Soon Be 100 Percent Solar Powered,42069,,675,Futurology
58,"Millennials 'have no qualms about GM crops' unlike older generation - Two thirds of under-30s believe technology is a good thing for farming and support futuristic farming techniques, according to a UK survey.",41913,,4043,Futurology
59,"Chinese factory replaces 90% of human workers with robots. Production rises by 250%, defects drop by 80%",41870,,5260,Futurology
60,Zuckerberg in DC exposes how little our governments understand where humanity is heading,41788,,1959,Futurology
61,"UN solution for a pollution free planet: polluters should pick up the bill. “The profit of destroying nature or polluting the planet is nearly always privatized, while the costs of polluting the planet or the cost of destroying ecosystems is nearly always socialized,”",41770,,1937,Futurology
62,South Korea is building a $35 billion city designed to eliminate the need for cars,41685,,2266,Futurology
63,"UK passes 1,000 hours without coal as energy shift accelerates",41382,,1330,Futurology
64,DNA surgery corrects human embryos of genetic defect for the first time ever.,41072,,2037,Futurology
65,Americans are willing to pay $177 a year to avoid climate change: And they want the money spent on clean energy.,40987,,3083,Futurology
66,Google Will Hit 100% Renewable Energy this Year - The company is primarily powered by wind and solar energy.,40864,,991,Futurology
67,"Two Infants Treated with Universal Immune Cells Have Their Cancer Vanish - In a medical first, the children were treated with genetically engineered T-cells from another person.",40766,,787,Futurology
68,"Colorado Political Candidate Promises to Give His Seat to an App - What if elected representatives actually voted based on what their constituents wanted?: ‘If more than 50% of people in his community vote ""yes"" on an issue through the app, Casas will vote the same way they do.’",40710,,3932,Futurology
69,Solar powered smart windows break 11% efficiency – enough to generate more than 80% of US electricity,40700,,1501,Futurology
70,"The cost of producing solar power is rapidly declining: it now costs $50 to produce one megawatt-hour of solar power. Coal, on the other hand, costs $102 per megawatt-hour to produce. This recent change could be a sign that the world is on the verge of an energy revolution.",40625,,2071,Futurology
71,"Face Recognition Glasses Augment China’s Railway Cops - Deployed to a Zhengzhou railway station 5 days ago, it has detected at least 7 fugitives and 26 fake ID holders",40569,,1830,Futurology
72,"China Invents Rice That Can Grow in Salt Water, Can Feed Over 200 Million People - Scientists in China succeeded in growing the yield of a strain of saltwater-tolerant rice nearly three times their expectation.",40350,,1192,Futurology
73,"Work less, get more: New Zealand firm's four-day week an 'unmitigated success' - Reduced hours for same pay increased work-life balance by 24%, cutting stress levels and boosting commitment",40288,,1872,Futurology
74,Elon Musk says Universal Basic Income is “going to be necessary.”,40183,,6130,Futurology
75,"Elon Musk Predicts How the Martian Government Will Operate: “Most likely, the form of government on Mars would be something of a direct democracy […] where people vote directly on issues instead of going through representative government.”",40122,,4381,Futurology
76,Harvard and MIT researchers have developed smart tattoo ink capable of monitoring dehydration and blood sugar by changing color.,39406,,1092,Futurology
77,"Why the 4-day workweek might be closer than you think: A New Zealand company dubbed its two-month trial of a four-day week a resounding success, making it a permanent fixture, and a school district in Colorado cut Mondays from its timetables in a bid to attract staff and cut costs.",39399,,2502,Futurology
78,"Billionaire Mark Cuban: The Rise of Technology Will Cause a Lot of Unemployment - ""There's going to be a lot of unemployed people replaced with technology and if we don't start dealing with that now, we're going to have some real problems,"" said Cuban.",39374,,5639,Futurology
79,Scientists are making carbon fiber from plants instead of petroleum,39150,,692,Futurology
80,"Why net neutrality’s peril raises the stakes for future satellite broadband options: “several ventures are getting set to put hundreds, and eventually thousands, of networked satellites in low Earth orbit, or LEO.”",39107,,1253,Futurology
81,Bill Gates Reveals His Father Suffers From Alzheimer's Disease – and He's Committing $100 Million to Stopping It,39079,,1834,Futurology
82,"The Billion Tree Project In Pakistan Is A Success - About 730 million trees were regrown using various forestry measures for regeneration, and three hundred million seedlings were planted using about 40 different species in the province of Khyber Pakhtunkhwa.",38999,,959,Futurology
83,"Richard Branson: “Basic income is going to be all the more important. If a lot more wealth is created by AI, the least that the country should be able to do is that a lot of that wealth that is created by AI goes back into making sure that everybody has a safety net.”",38939,,3981,Futurology
84,"Toyota surpasses 3,000 Mirai hydrogen fuel cell vehicle sales: With a range of 502 kilometres and refueling time of approximately five minutes, the Mirai creates electricity using hydrogen, oxygen and a fuel cell, and emits nothing but water vapour in the process",38919,,2786,Futurology
85,France To Shut Down All Its Coal Power Plants By 2023,38432,,1781,Futurology
86,"Walmart Officials Plan To Cut Thousands Of Jobs Through Store Closures, Automation - Walmart credited the tax plan for its recent bonuses and pay increases, while at the same time quietly planning to eliminate stores and create facilities that have no cashiers.",38365,,5011,Futurology
87,Why thousands of AI researchers are boycotting the new Nature journal - Academics share machine-learning research freely. Taxpayers should not have to pay twice to read our findings,38364,,990,Futurology
88,Tesla releases details of its solar roof tiles: cheaper than regular roof with ‘infinity warranty’ and 30 yrs of solar power,38242,,2641,Futurology
89,"Arnold Schwarzenegger: 'Go part-time vegetarian to protect the planet' - ""Emissions from farming, forestry and fisheries have nearly doubled over the past 50 years and may increase by another 30% by 2050""",38058,,7162,Futurology
90,Tesla’s giant battery in Australia made around $1 million in just a few days,37762,,1406,Futurology
91,Bill Nye's Open Letter to President Donald Trump,37427,,4407,Futurology
92,"Continuous low doses of far ultraviolet C (far-UVC) light can kill airborne flu viruses without harming human tissues, according to a new study, which suggests that use of overhead far-UVC light in airports and other public spaces could provide a powerful check on influenza epidemics and pandemics.",37355,,913,Futurology
93,"Coal only supplied 2% of electricity in the United Kingdom during the first six months of 2017 - a stark contrast to just five years ago, where coal represented about 40% of the electricity mix",37315,,1231,Futurology
94,This weed-killing AI robot uses 20 percent less herbicide and may disrupt a $26 billion market,37227,,1321,Futurology
95,Warren Buffett on the US economy: ‘The tsunami of wealth didn’t trickle down. It surged upward’ - “Americans will benefit from far more and better 'stuff' in the future. The challenge will be to have this bounty deliver a better life to the disrupted as well as to the disrupters“,37043,,3597,Futurology
96,"Microsoft founder Gates commits $100 million for fund, start-ups, to fight Alzheimer's",37032,,1712,Futurology
97,"Baltimore's solar-powered water wheel has now removed 1.1 million lbs of rubbish from the river - ""Some of that rubbish includes 8.9 million cigarette butts and half a million polystyrene containers.""",36952,,1679,Futurology
98,California Poised To Hit 50% Renewable Target A Full Decade Ahead Of Schedule,36733,,1423,Futurology
99,"If Americans would eat beans instead of beef, the US would immediately realize approximately 50 to 75% of its greenhouse gas reduction targets for the year 2020, according to researchers from four American universities in a new paper.",36609,,9576,Futurology
100,"Trump Can't Stop the Energy Revolution -President Trump can't tell producers which power generation technologies to buy. That decision will come down to cost in the end. Right now coal's losing that battle, while renewables are gaining.",36555,,4914,Futurology
101,Boston Dynamics - Introducing Handle,36505,,3875,Futurology
102,"Elon Musk admits humans are sometimes superior to robots: “Yes, excessive automation at Tesla was a mistake. To be precise, my mistake. Humans are underrated”",36322,,1814,Futurology
103,"Giving every adult in the United States a $1,000 cash handout per month would grow the economy by $2.5 trillion by 2025, according to a new study on universal basic income.",35877,,11476,Futurology
104,"Renewables are no longer ‘alternative.’ Fossil fuels are ‘legacy.’ - ""The shape of the future is becoming clearer, as first coal, and now oil and gas, give way to solar, wind and battery power.""",35818,,2324,Futurology
105,Wiping out mosquitoes from countries ravaged by malaria does NOT have a negative impact on other native species,35733,,1788,Futurology
106,Solar Power is now the cheapest form of energy on the planet and costs are still falling rapidly.,35684,,2821,Futurology
107,Tyson: U.S. science illiteracy a serious threat - “You have mortgaged the future financial security of your nation. Innovations in science and technology are the (basis) of tomorrow’s economy.”,35553,,2932,Futurology
108,"Cannabidiol (CBD), a compound derived from the cannabis plant that does not produce a “high”, was shown in a new large-scale, randomized, controlled trial to significantly reduce the number of dangerous seizures in patients with a severe form of epilepsy called Lennox-Gastaut syndrome.",35547,,1326,Futurology
109,Denmark Is Selling Off Its Last Oil Company And Spending The Money On Wind Power - Denmark has pledged to completely wean itself off fossil fuels by 2050.,35392,,586,Futurology
110,Why Stephen Hawking Urged Humanity to Leave Earth: “It is time to explore other solar systems. Spreading out may be the only thing that saves us from ourselves. I am convinced that humans need to leave Earth.”,35293,,1298,Futurology
111,A fully functional and animated Cortana hologram.,35229,,1337,Futurology
112,"China has started ranking citizens with a creepy 'social credit' system — here's what you can do wrong, and the embarrassing, demeaning ways they can punish you: The program is due to be fully operational by 2020, but is being piloted for millions of people already. The scheme is mandatory.",35117,,4804,Futurology
113,"Elon Musk Rips the Idea of Flying Cars at TED 2017: “They’ll be quite noisy, the wind-force generated will be very high. And let’s just say that if something’s flying over your head, that is not an anxiety-reducing situation.”",35093,,2647,Futurology
114,"Solar, wind and nuclear power each provide more electricity than gas and coal combined for first time in the United Kingdom",35042,,1260,Futurology
115,"Andrew Yang Wants You To Vote For A $1,000-A-Month Basic Income In 2020",34779,,6705,Futurology
116,Marijuana Industry Projected To Create More Jobs Than Manufacturing By 2020,34746,,1910,Futurology
117,"A Tesla employee who builds robots told us why production hell is actually a good thing: “It's a glimpse into Musk's plans for factories of the future: almost fully automated, with robots that can build cars so fast that air resistance becomes a problem.”",34630,,3254,Futurology
118,Most Americans will happily try eating lab-grown “clean meat”,34585,,3271,Futurology
119,France will 'ban all petrol and diesel vehicles by 2040',34477,,2478,Futurology
120,"Self-driving cars could kill hundreds but save tens of thousands, Toyota executive says",34430,,2867,Futurology
121,Elon Musk: we must colonise Mars to preserve our species in a third world war,34386,,3558,Futurology
122,Scientists design solar cell that captures sunlight with up to 44.5% efficiency; potentially making it the most efficient solar cell yet,34242,,1233,Futurology
123,California Beat Its 2020 Emissions Target Four Years Early,34217,,1116,Futurology
124,"Tesla is now worth more than Ford, and what this indicates about the future of the green economy.",34136,"In a recent [Electrek](https://electrek.co/2017/03/27/tesla-tsla-valuable-ford/) post, the news is delivered with understatement: Tesla now has a larger market capitalization than Ford Motor Company.

However, the article makes certain points that are worth thinking about before the enthusiasm gets out of hand: Namely that market cap is a measure of stock value rather than necessarily the fundamentals of a company, although those too are continuously increasing for Tesla as it builds out its Gigafactory 1 in Nevada, solar panel factory in New York, and various other facilities.

Ford remains overwhelmingly dominant compared to Tesla in its pace of manufacturing and delivery, and yet the news is a milestone in a trend that has been unfolding for years.  Tesla has been continuously advancing its ability to produce, and despite occasional dips in stock price, the stock has kept well ahead of the shockwave.

A company that was not supposed to exist according to...well...*everyone*...now has a market capitalization of $45 billion, after a decade and a half of growth and hard-fought survival at times.  But here's where the future interest comes into light: Tesla is no longer ""merely"" a car company.

Tesla is growing both up and down its own supply chain - expanding across its own entire industrial sector - entering the energy production, energy storage, and energy management industries that will increase the value of its cars.  It is also *creating* an entire industrial science of the factory-as-product, rooted in designing whole factories as if they were single products limited only by the basic laws of physics.

A lot of OEM companies extend tendrils into their own supply chains, but these are usually just hedges - they maintain a basic capacity to serve their own needs if a major supplier has a serious interruption.  And, of course, as leverage in negotiations with their suppliers if someone is trying to strong-arm them.  That is not what Tesla is doing.

Tesla is out for conquest.  Having watched this company evolve since a decade ago, and watched its vision evolve, I can say that it intends - over the longest term - to become the world's dominant producer of clean energy infrastructure, related systems, and the building and transport technologies that utilize it.

Disaster is entirely possible when ambitions are so grand, and Tesla has averted it so often that one has to wonder if Musk's genius is not mixed in with some strain of adrenaline-driven recklessness, but sooner or later you have to admit that the best guide to what someone will achieve in the future is what they have already achieved in the past.

Tesla has the tools, the talent, and the ambition to own the world.  I think they will.  They will change the energy and transport systems of the world, and possibly the basic way in which we manufacture on a large scale.  Over decades, I think they will surpass all other automakers, and then surpass them all *combined*, beginning to then challenge companies like Apple and Google - who have themselves shown awareness of the danger by experimenting with entering the auto market.  The world's first trillion-dollar company may be among us.

But knock on wood.  Knock on it soundly.",2721,Futurology
