,title,ups,selftext,num_comments,subreddit
524,"Online privacy is making a comeback: Next May, an EU regulation will enshrine the protection of personal data into law and not even Brexit is going to stop it",16595,,785,Futurology
525,"Elon Musk says to expect “major” Tesla hardware revisions almost annually - ""advice for prospective buyers hoping their vehicles will be future-proof: Shop elsewhere.""",16593,,2292,Futurology
526,"We could soon be painting our houses with 'solar paint' for clean energy - ""researchers in Australia have come up with a “solar paint” capable of absorbing moisture from the air and turning it into hydrogen fuel for clean energy.""",16586,,690,Futurology
527,"PepsiCo reserves 100 Tesla Semis, likely at $20,000 a pop",16568,,931,Futurology
528,"Google joins Apple in condemning the repeal of the Clean Power Plan: “The Clean Power Plan, which was finalized in 2016, calls for power plants — the biggest carbon polluters in the US — to cut their greenhouse gas emissions by roughly 32 percent by the year 2030.”",16558,,721,Futurology
529,"Florida State University researcher makes an exponential advance in suicide prediction, potentially giving clinicians the ability to predict who will attempt suicide up to 2 years in advance with 80% accuracy using machine learning.",16558,,949,Futurology
530,"Eric Schmidt says America needs to ‘get its act together’ in AI competition with China - ‘Trust me, these Chinese people are good’",16534,,2099,Futurology
531,China signs $300m deal to buy lab-grown meat from Israel,16514,,1566,Futurology
532,"Raytheon has developed a laser-guided, rocket-powered grenade. It can be fired from a rifle and hit targets a mile and a half away.",16463,,1430,Futurology
533,Alphabet's Project Loon authorized to deploy balloons in Puerto Rico to provide emergency LTE coverage,16428,,510,Futurology
534,In world 1st - Australian Hospital opens Biofabrication Institute specializing in 3D printed human tissue,16423,,640,Futurology
535,Google Has Quietly Dropped Ban on Personally Identifiable Web Tracking,16417,,1229,Futurology
536,"Nearly half of patients reversed type 2 diabetes in trial. People spent up to five months on a low-calorie diet of soups and shakes to trigger massive weight loss. A year later, 46% of patients who started the trial were in remission to a non-diabetic state, and off antidiabetic drugs.",16405,,1498,Futurology
537,Germany had so much renewable energy on Sunday that it had to pay people to use electricity,16395,,1775,Futurology
538,"For The Cost Of An iPhone, You Can Now Buy a Wind Turbine That Can Power An Entire House For a Lifetime",16310,,1007,Futurology
539,"Swedish supermarkets replace sticky labels with laser marking: Food retailers aiming to cut plastic packaging by ditching stickers on fruits and vegetables, instead using hi-tech ‘natural branding’",16313,,785,Futurology
540,"Artificial Intelligence: World is ‘'astonishingly pessimistic,’ says EU research commissioner. Media are too full of ‘alarmist, hysterical’ doomsday scenarios, says Carlos Moedas, as EU looks at ways to block flow of online misinformation",16302,,1808,Futurology
541,Physicists have observed the light spectrum of antimatter for first time,16281,,1091,Futurology
542,Tesla is holding a hackathon to fix two problematic robot bottlenecks in Model 3 production,16234,,1138,Futurology
543,Elon Musk’s giant tunnel boring machine arrived at SpaceX – first pictures,16223,,2047,Futurology
544,"Tesla wants to build special charging stations that sell food and coffee — and it could be a huge opportunity: retail-and-lifestyle focused ""Mega Supercharger locations.""",16185,,1311,Futurology
545,Scientists achieve direct counterfactual quantum communication for the first time,16149,,1516,Futurology
546,"Coal will not recover | Coal does not have a regulation problem, as the industry claims. Instead, it has a growing market problem, as other technologies are increasingly able to produce electricity at lower cost. And that trend is unlikely to end.",16141,,2293,Futurology
547,"Automation in the pot industry is picking up with unforeseen speed - Legal marijuana sales in the US and Canada are now expected to pass $20.2 billion by 2021, and by 2020 the marijuana industry will provide more jobs than each of the manufacturing, utilities or government sectors.",16098,,1121,Futurology
548,The Largest Coal Plant In The Western U.S. Is Closing Decades Ahead Of Schedule,16080,,905,Futurology
549,"Scotland could become a leader in automation by mounting a full-scale island experiment to test the technologies of the future, and transform one of its communities with tech advances like self-driving cars and economic redesigns such as introducing a citizen’s income.",16074,,371,Futurology
550,"Last male northern white rhino is put down - To try to preserve the species, genetic material was collected from Sudan before he was euthanised. Staff at the park hope that, through “advanced cellular technologies” and IVF, his death will not signal the end of the species.",16065,,715,Futurology
551,Today r/Futurology is going to #BreakTheInternet to save net neutrality,16040,"On Dec 14th, the FCC is going to kill the open internet, and end net neutrality. There will be nothing to stop Internet Service Providers like Comcast and Verizon from charging us extra fees to access the online content we want -- or throttling, blocking, and censoring websites and apps.


This affects every redditor and every Internet user, and we only have a 48 hours left to stop it. Contact lawmakers now and tell them not to destroy net neutrality!


Please, take a moment of your time to [join the protest](https://www.battleforthenet.com/breaktheinternet/) and [contact Congress](https://battleforthenet.com/) to save net neutrality.

UPDATE: For mods of other subs who are interested in participating in #BreakTheInternet, here is a link to the theme to modify your sub, and the announcement text:

https://www.reddit.com/r/KeepOurNetFree/comments/7j3vy4/heres_a_theme_that_any_subreddit_can_use_to/",861,Futurology
552,"Gene editing saves girl dying in UK from leukaemia in world first. Total remission, after chemotherapy and bone marrow transplant fails, in just 5 months",16040,,1442,Futurology
553,Reports Reveal Beijing To Cut Coal Use By 30% in 2017,16032,,710,Futurology
554,Jeb Bush warns robots taking US jobs is not science fiction,15996,,1552,Futurology
555,Tesla is investing $350 million in its Nevada factory and hiring hundreds of workers,15977,,1005,Futurology
556,Japan just debuted the world's largest indoor farm using LED lights that emit wavelengths optimal for plant growth; The upshot: grows 2.5x faster than outdoors; reduces produce loss from 50% to just 10% and cuts water usage to just 1%,15974,,2237,Futurology
557,France imposes a ban on plastic cups and cutlery,15956,,1259,Futurology
558,"James Hansen, the ex-NASA scientist who initiated many of our concerns about global warming, says the real climate hoax is world leaders claiming to take action while being unambitious and shunning low-carbon nuclear power.",15940,,1039,Futurology
559,"By 2020, China will have completed its nationwide facial recognition and surveillance network, achieving near-total surveillance of urban residents, including in their homes via smart TVs and smartphones.",15931,,1845,Futurology
560,Why the Tesla truck will turn freight industry upside own,15946,,2248,Futurology
561,"Decline of the dentist's drill? Drug helps rotten teeth regenerate, trial shows",15897,,1322,Futurology
562,New AI more effective at analyzing legal contracts than lawyers,15894,,890,Futurology
563,A.I. Will Serve Humans—But Only About 1% of Them,15861,,1483,Futurology
564,"Forget Tesla's Solar Roof: This Startup Tells Us Solar Window is the Future - “The company claims that, when installed on a 50-story building, its solar windows could generate up to 50 times more power than conventional roof panels.”",15852,,939,Futurology
565,Multi-million dollar upgrade planned to secure 'failsafe' Arctic seed vault,15836,,573,Futurology
566,Ten years left to redesign lithium-ion batteries. Reserves of cobalt and nickel used in electric-vehicle cells will not meet future demand.,15838,,1266,Futurology
567,"Bill Gates: It's 'scary to me' that technology can empower small groups to do great harm - ""A small group can have an impact — in the case of nuclear [weapons], on millions; and in the case of bio[terror], on billions. That is scary to me.""",15830,,1147,Futurology
568,A new kind of doctor's office charges a monthly fee and doesn't take insurance — and it could be the future of medicine,15829,,2753,Futurology
569,"Burger King owner vows to end use of antibiotics in chicken, joining other major fast-food chain operators in battle against the rise of dangerous antibiotic-resistant bacteria known as superbugs.",15777,,581,Futurology
570,"Why Automation is Different This Time - ""there is no sector of the economy left for workers to switch to""",15757,,3885,Futurology
571,China will soon trump America: The country is now the global leader in climate change reform,15748,,2191,Futurology
572,"The world's first US-Australia biofuel flight took off on Monday, with a Qantas Boeing 787 Dreamliner filled with 24,000 kilograms of mustard seed-based, blended fuel.",15741,,550,Futurology
573,"Japanese engineer builds giant robot to realize 'Gundam' dream - Developed at a maker of farming machinery, it is an 8.5-meter (28-feet) tall, two-legged robot weighing in at more than 7 tonnes. It contains a cockpit with monitors and levers for the pilot to control the robot’s arms and legs.",15739,,578,Futurology
574,"At 6 least major countries, including Canada, France, Germany, the Netherlands, Austria and now Finland, have all recently announced the imminent phase-out of all coal-fired power plants.",15708,,660,Futurology
575,Uber CEO To Tesla: Sell Me Half A Million Autonomous Electric Cars In 2020,15698,,3999,Futurology
576,United Nations Human Rights discusses Universal Basic Income,15623,,3071,Futurology
577,We now have the genetic recipe for making tomatoes taste like tomatoes again,15621,,1798,Futurology
578,"Australian researchers have discovered that peptides contained in the milk of Tasmanian devils can kill some of the most deadly bacterial and fungal infections, including golden staph.",15612,,605,Futurology
579,UK and Canada announce global alliance to end coal power,15536,,826,Futurology
580,Tesla will begin selling its solar roof this year,15531,,869,Futurology
581,An artificial womb successfully grew baby sheep,15468,,1476,Futurology
582,"Princeton researchers crowdsource brain mapping with gamers, discover six new neuron types - With the help of a quarter-million video game players, researchers have created detailed maps of more than 1,000 neurons, a digital museum that shows off the intricate beauty of the retina’s neural circuits.",15465,,127,Futurology
583,Artificially Intelligent Lawyer “Ross” Has Been Hired By Its First Official Law Firm,15459,,1559,Futurology
584,Cancer patient on new drug trial left with no trace of disease after being given 18 months to live,15442,,588,Futurology
585,Google Unveils 72-Qubit Quantum Computer With Low Error Rates,15409,,1048,Futurology
586,"'Incredible' News as Banking Giant HSBC Ditches New Coal, Tar Sands, and Offshore Arctic Drilling Projects: “the era of fossil fuels is coming to a close.""",15380,,486,Futurology
587,Physicists and chemists at the University of Bristol have found a way to convert thousands of tonnes of seemingly worthless nuclear waste into man-made diamond batteries that can generate a small electric current for longer than the entire history of human civilization.,15314,,927,Futurology
588,"Bill Gates wants to tax robots, but one robot maker says that's 'as intelligent' as taxing software - ""They are both productivity tools. You should not tax the tools, you should tax the outcome that's coming.""",15318,,2218,Futurology
589,China freezes approval for new nuclear power due to competition from renewables,15298,,1270,Futurology
590,"A robot can print this $64,000 house in as few as 8 hours — take a look inside",15294,,1142,Futurology
591,Elon Musk is Looking to Kickstart Transhuman Evolution With “Brain Hacking” Tech,15254,,2223,Futurology
592,"AI and Chinese doctors: “At least 40 hospitals in China have deployed IBM’s Watson... Beijing-based Huiyihuiying, for instance, said it has AI doctors capable of interpreting CT scans... reading a CT scan and making diagnoses within seconds compared to five minutes needed by human doctors.”",15234,,886,Futurology
593,Urban 'forests' can store almost as much carbon as tropical rainforests,15208,,366,Futurology
594,"The world's largest solar farm rises in the remote Egyptian desert - The $2.8-billion Benban complex, is set to open next year, and is expected to generate as much as 1.8 gigawatts of electricity. By 2025 Egypt plans to get 42% of its electricity from renewable sources.",15180,,700,Futurology
595,Leaked document shows the White House planning to force Americans to spend $311m-$11.8b/year to keep unprofitable coal and nuclear energy plants from shutting / Boing Boing,15176,,1343,Futurology
596,"IKEA flags selling solar panels “at cost” in Australia, industry reacts",15155,,793,Futurology
597,"Tesla’s fleet has driven 7.2 billion miles and its energy products produced 10.3 billion kWh - between the EV fleet and its energy products, Tesla saved 7.4 million tons of CO2 from being released into our atmosphere.",15100,,797,Futurology
598,New Bipartisan Legislation Would Repeal Solar Tariffs: “I don’t know what good can possibly come as a consequence of stifling the growth of solar power.”,15100,,613,Futurology
599,Tesla Model X breaks electric towing Guinness World Record by pulling a Qantas Boeing 787-9 Dreamliner,15058,,858,Futurology
600,1 billion could be using 5G by 2023 with China set to dominate,15033,,1137,Futurology
601,"Energy groups join together to condemn plan to subsidize nuclear, coal plants: “A policy to spend billions of dollars keeping uneconomic power plants afloat, while trying to put clean and affordable solar on the sidelines, is not a recipe for economic success.”",15014,,1633,Futurology
602,Why Tesla’s new solar roof tiles and home battery are such a big deal,14994,,1601,Futurology
603,"Stephen Hawking's final research paper, just published in an open access journal, suggests that our Universe may be one of many similar to our own. It points a way forward for astronomers to find evidence of the existence of parallel universes. The study was submitted 10 days before he died.",14989,,471,Futurology
604,Tesla making model 3 battery packs in 17 minutes down from 7 hours,14957,,637,Futurology
605,Stephen Hawking: Most of our history is the history of stupidity,14953,,1613,Futurology
606,Tesla’s giant battery in Australia reduced grid service cost by 90%,14944,,461,Futurology
607,Elon Musk’s Boring Company announces ‘partnership’ with LA Metro for its tunnel network under Los Angeles.,14927,,749,Futurology
608,"U.K. startup uses recycled plastic to build stronger roads - ""a street that’s 60 percent stronger than traditional roadways, 10 times longer-lasting""",14919,,1069,Futurology
609,"There are over 341,000 wind turbines on the planet, why they matter - The DOE's Wind Vision Report says that wind could potentially support more than 600,000 jobs by the year 2050 and help avoid 12.3 gigatonnes of greenhouse gases.",14916,,951,Futurology
610,Scientists just trained genetically modified salmonella to eat cancerous tumors,14914,,621,Futurology
611,"California's cannabis market is expected to soar to $5.1 billion — and it's going to be bigger than beer: California is set to begin sales of recreational marijuana on January 1. The market is expected to hit $3.7 billion in 2018 alone, and that number will increase to over $5 billion in 2019.",14884,,1135,Futurology
612,"Could a heroin vaccine cure the west’s drug epidemic? Researchers in California recently announced a vaccine that can block the narcotic effects of heroin in mice and monkeys, and they say that human clinical trials are on the horizon.",14869,,1320,Futurology
613,"Aubrey de Grey, who is more widely known as a maverick biologist intent on extending the human lifespan, has cracked the Hadwiger-Nelson problem which has flummoxed mathematicians worldwide since 1950",14865,,526,Futurology
614,Roll-up solar panels power Flat Holm island - “The Rapid Roll system allows flexible solar panels to be unrolled like a carpet from a trailer in two minutes... The hope is for the technology in future to offer a solution in areas hit by natural disasters like hurricanes.”,14858,,327,Futurology
615,Astronauts on the International Space Station will eat food they grew themselves in space for the 1st time this week.,14855,,604,Futurology
616,"Cannabidiol slashes seizures in kids with rare epilepsy, study finds - randomized, double-blind, placebo-controlled human trial published in NEJM",14837,,714,Futurology
617,"A Zombie Gene Protects Elephants From Cancer: A new study reveals how 'an old gene that was no longer functional was recycled from the vast “genome junkyard” to increase the sensitivity of elephant cells to DNA damage, enabling them to cull potentially cancerous cells early.'",14829,,331,Futurology
618,"Japan starts space elevator experiments - Obayashi envisages a space elevator using six oval-shaped cars, each measuring 18m x 7.2m holding 30 people, connected by a cable from a platform on the sea to a satellite at 36,000 kilometers above Earth.",14817,,1483,Futurology
619,"A South African girl born with the AIDS virus has kept her infection suppressed for more than eight years after stopping anti-HIV medicines — more evidence that early treatment can occasionally cause a long remission that, if it lasts, would be a form of cure.",14808,,278,Futurology
620,"Instead of Filling Cavities, Dentists May Soon Regenerate Teeth - Researchers recently discovered certain drugs, including one developed to treat Alzheimer’s, stimulate innate self-repair mechanisms",14799,,421,Futurology
621,Bill and Melinda Gates are giving $4 million to help scientists engineer a malaria-killing mosquito — here’s how it could work,14795,,700,Futurology
622,Amazon is going to kill more American jobs than China did,14771,,2421,Futurology
623,Former Tesla executives plan their own Gigafactory in Sweden to bring battery cost down below $100/kwh,14722,,700,Futurology
624,Facebook co-founder: Tax the rich at 50% to give $500-a-month free cash and fix income inequality,14689,,3676,Futurology
625,"Game Over For Coal: Scientists Nail Down Pesky Perovksite Solar Cell Problem - “The research team successfully tested a perovskite solar cell in ambient conditions without protection for 1,000 hours, and it retained 94% of its conversion efficiency.”",14668,,837,Futurology
626,"A Proterra electric bus just drove 1,100 miles on a single charge",14652,,469,Futurology
627,"Wind Power Means Jobs in Texas, and Partisan Politics Isn't Going to Stop It - Wind turbines bring jobs, tax dollars for new schools, income security for farmers and energy independence. To Texans, climate change has little to do with it.",14623,,683,Futurology
628,"""The terminally ill man who is set to become the world's first head transplant recipient says more details about his extraordinary surgery will be revealed next month [September 2016]. Valery Spiridonov, a computer scientist from Russia, is set to undergo the risky procedure next year [2017].""",14598,,3095,Futurology
629,"Tesla plans to choose location for ‘Gigafactory 2’ in Europe next year, will produce both batteries and cars",14587,,920,Futurology
630,"Tesla Gigafactory 1 now employs over 3,000 workers as it becomes biggest battery factory in the world",14582,,1157,Futurology
631,"There's a medical problem that marijuana might be able to help that no one is talking about - ""The idea behind High Sobriety is simple: Help addicts stop abusing the substances that are causing them the most harm, and use cannabis as a tool to do so.""",14585,,1671,Futurology
632,"We’re headed for a future where only the wealthy can enjoy nature - A thousand years from now people will yearn for nature, beauty, open space, and public lands.",14544,,936,Futurology
633,High-speed broadband to be legal right for UK homes and businesses - Government says internet providers will be legally obliged from 2020 to meet user requests for speeds of at least 10Mbps,14533,,777,Futurology
634,"Bill Gates’ Smart City in Arizona Is Not Smart, Not a City, and Has Little to Do With Bill Gates",14474,,449,Futurology
635,The Dutch government confirms plan to ban new petrol and diesel cars by 2030,14465,,785,Futurology
636,"Stephen Hawking Says We Should Really Be Scared Of Capitalism, Not Robots",14452,,5935,Futurology
637,"DARPA is working on a ""one-way"" cardboard delivery drone; A small, single-use aircraft that can be deployed from larger aircraft, carry supplies to isolated locations and then biodegrade after a few days",14434,,945,Futurology
638,Astronomers may have found giant alien 'megastructures' orbiting star near the Milky Way,14417,,5869,Futurology
639,Should we wipe mosquitoes off the face of the Earth?,14418,,3597,Futurology
640,"Bill Gates thinks a coming disease could kill 30 million people within 6 months — and says we should prepare for it as we do for war: According to Gates, a small non-state actor could build an even deadlier form of smallpox in a lab.",14380,,1127,Futurology
641,"Washington Governor Calls Self-Driving Car Tech 'Foolproof,' Allows Tests Without Drivers - The governor has signed an order that allows autonomous car testing to begin in the state in just under two months.",14362,,1414,Futurology
642,Shift to automation may prevent Trump from delivering on his jobs promise,14353,,3905,Futurology
643,Ecstasy was just labelled a 'breakthrough therapy' for PTSD by the FDA,14342,,1083,Futurology
644,"New Wearable Sensor Detects Stress Hormone in Sweat - Cortisol is key to tracking stress, but it's tough to measure in an instant; Stanford researchers say they've figured out how",14313,,395,Futurology
645,Robotics Expert Predicts Kids Born Today Will Never Drive a Car - Motor Trend,14296,,2885,Futurology
646,"The male Y chromosome is progressively degenerating. Studies have shown that the chromosome is undergoing a structural rearrangement in order to slow the effects of decline. In the future, genetic engineering may be able to replace the gene function of the Y chromosome.",14297,,1519,Futurology
647,The World’s 1st Molecular Robot Has Just Been Created by UK Scientists,14263,,363,Futurology
648,A filter that turns saltwater into freshwater just got an upgrade - Smoothing out the rough patches of a material widely used to filter saltwater could make producing freshwater more affordable,14239,,470,Futurology
649,A growing number of people think their job is useless. Time to rethink the meaning of work,14237,,2161,Futurology
650,"“The greatest threat that humanity faces from artificial intelligence is not killer robots, but rather, our lack of willingness to analyze, name, and live to the values we want society to have today""",14238,,635,Futurology
651,"Stephen Hawking's final Reddit post was an ominous warning about the future of humanity and capitalism: “The trend seems to be toward the second option, with technology driving ever-increasing inequality”",14201,,1053,Futurology
652,"Elon Musk: ""There's a Pretty Good Chance We'll End Up With Universal Basic Income""",14190,,4462,Futurology
653,"It Doesn’t Matter How Much Trump, Pruitt, and America Love Gas Guzzlers. Cars Are Going Electric.",14129,,2061,Futurology
654,"A global biodiversity collapse is imminent unless we take urgent, concerted action to reverse species loss in the tropics, according to new study in Nature, the first on state of all four of world´s most diverse tropical ecosystems – tropical forests, savannas, lakes and rivers, and coral reefs.",14111,,889,Futurology
655,Researchers have developed a method to eliminate scarring by prompting wounds to heal as normal skin rather than as scar tissue.,14103,,373,Futurology
656,"AI could boost productivity but increase wealth inequality, the White House says",14101,,3297,Futurology
657,"Elon Musk Says Advanced A.I. Could Take Down the Internet: ""Only a Matter of Time.""",14100,,2605,Futurology
658,Europe’s heatwave is forcing nuclear power plants to shut down,14064,,1514,Futurology
659,New York City to swap out payphones for free high-speed Wi-Fi hot spots,14013,,1271,Futurology
660,"This Week In Technology - August 19, 2017",13989,,1113,Futurology
661,"""Do You Trust This Computer"" is the most important film of 2018, exploring the current state and future of AI on earth, and is free for the next 36 hours. Directed by Chris Paine (director of Who Killed The Electric Car)",13998,,925,Futurology
662,"Deepmind announces a major AI breakthrough - it's video game learning AI, can now remember previous games &amp; re-apply lessons learnt there to figuring out new games.",13970,,990,Futurology
663,The largest virtual Universe ever simulated: Researchers from the University of Zurich have simulated the formation of our entire Universe with a large supercomputer. A gigantic catalogue of about 25 billion virtual galaxies has been generated from 2 trillion digital particles.,13939,,1054,Futurology
664,"Microsoft enters race to find cancer cure - The research is based at Microsoft’s ‘biological computation’ labs in Cambridge, U.K.",13923,,498,Futurology
665,China is now getting its power from the largest floating solar farm on Earth,13874,,1166,Futurology
