,title,ups,selftext,num_comments,subreddit
241,"European science funders ban grantees from publishing in paywalled journals - As of 2020, the group, which jointly spends around €7.6 billion on research annually, will require every paper it funds to be freely available from the moment of publication.",25562,,494,Futurology
242,Tesla CEO Elon Musk challenges Big Coal to go toe-to-toe with 0 subsidies after being called a fraud,25384,,2859,Futurology
243,"During Puerto Rico’s Blackout, Solar Microgrids Kept The Lights On: As the utility on the island continues to fail, new systems of renewables–installed after the storm–are showing what a more resilient grid could look like.",25351,,692,Futurology
244,"All-electric ferry cuts emission by 95% and costs by 80%, brings in 53 additional orders",25359,,833,Futurology
245,"China Is Showing the World What Renewable Energy Dominance Looks Like, Says New IEA Report. “In one year, China will install the equivalent of the total history of solar development in Germany.”",25322,,2093,Futurology
246,Electric car emissions slashed by two thirds as electricity generation goes green,25279,,1236,Futurology
247,"Electric mining truck generates more electricity than it uses, due to more load going downhill.",25250,,1214,Futurology
248,"An Air Force Academy cadet created a bullet-stopping goo to use for body armor - ""Weir's material was able to stop a 9 mm round, a .40 Smith &amp; Wesson round, and eventually a .44 Magnum round — all fired at close range.""",25182,,1046,Futurology
249,Elon Musk's next project involves creating solar shingles – roofs completely made of solar panels.,25186,,2799,Futurology
250,"Trump Can’t Save Coal: More Capacity Closed Already in 2018 Than in Obama’s Entire First Term - “Beautiful, clean coal” is not seeing a resurgence, despite what the president claims.",25173,,1593,Futurology
251,"For First Time in History, Solar Jobs Outnumber Coal Jobs in Virginia",25094,,894,Futurology
252,"Stockton, California is the first American city to test a simple yet unorthodox experiment called universal basic income. It plans to deliver $500 a month in donated cash to perhaps 100 local families, no strings attached. The trial could start as soon as the fall and continue for about two years.",25086,,3027,Futurology
253,Nasa has created futuristic chainmail to protect from space debris.,25083,,1455,Futurology
254,"Chicago, which has committed to power its 900 municipal buildings with 100% renewable electricity by 2025, has joined a seven-city collaboration, which includes Los Angeles, Houston, Portland, OR, Orlando, FL, and Evanston, IL.",25025,,940,Futurology
255,Scientists reverse ageing in mammals and predict human trials within 10 years,24938,,4040,Futurology
256,"NASA: We're Not Racing SpaceX to Mars - ""If Elon Musk brought the samples in the door right now I'd throw him a party out of my own money,"" Thomas Zurbuchen, NASA's newly named associate administrator for science.",24921,,1621,Futurology
257,"Tesla deploys 6 battery projects in order to power two islands in Puerto Rico, more to come",24779,,850,Futurology
258,Elon Musk Responds to Boeing's Claims It Will Fly to Mars First: “Do it”,24734,,1556,Futurology
259,"‘Deep learning’ computational-imaging system correctly predicted with a 97% accuracy which patients were already showing evidence of pending heart failure, compared to two pathologists who were correct 74% and 73% respectively.",24714,,581,Futurology
260,"The U.S. government says self-driving cars “will save time, money and lives” and just issued policies endorsing the technology",24695,,3987,Futurology
261,U.S. $23 trillion will be lost if temperatures rise four degrees by 2100. Economic modelling suggests this is the reality facing us if we continue emitting greenhouse gases and allowing temperatures to rise unabated.,24673,,2555,Futurology
262,Scientists Just Successfully Reversed Ageing in Lab Grown Human Cells,24630,,1874,Futurology
263,Bill Gates: 'Robots that take jobs should be taxed just like the people they replace',24630,,2577,Futurology
264,"We Can Now Store Light as Sound, And It's a Game Changer For Computing",24613,,868,Futurology
265,"SpaceX CEO Elon Musk cites his goal to ""make humanity a multi-planet civilization"" as one of the reasons he won't quit Trump's Advisory Council. It would mean the ""creation of hundreds of thousands of jobs and a more inspiring future for all.""",24568,,2400,Futurology
266,Economists worry we aren’t prepared for the fallout from automation - Too much time discussing whether robots can take your job; not enough time discussing what happens next,24529,,2663,Futurology
267,"Researchers at The University of Texas at Dallas have developed a high-powered, environmentally safe lithium-sulfur substitute that could drastically lengthen battery life",24488,,821,Futurology
268,Atlanta Commits To 100 Percent Renewable Energy By 2035,24456,,854,Futurology
269,The government is ratcheting up its surveillance powers. But we can stop this - The people demanding these new powers have proven that they cannot be trusted with the powers they already have,24405,,1003,Futurology
270,"Europe to ban halogen lightbulbs - After nearly 60 years of brightening our homes and streets, halogen lightbulbs will finally be banned across Europe on 1 September, to be replaced with more energy efficient LEDs",24399,,2142,Futurology
271,"Elon Musk: 'If we are successful with this, it is game over for all the other heavy lift rockets'",24373,,1271,Futurology
272,Elon Musk thinks flying cars are a terrible idea - 'It could drop a hubcap and guillotine you',24352,,2658,Futurology
273,"Ambitious Plan Would Bring Statewide Public Broadband to Michigan - ""Mi-Fi"" would treat the Internet like a utility instead of a commodity.",24319,,767,Futurology
274,Winds of change: Britain now generates twice as much electricity from wind as coal,24298,,695,Futurology
275,"Tesla’s solar roof to cost less than a regular roof – even before energy production, says Elon Musk",24257,,1557,Futurology
276,Britain's Next Megaproject: A Coast-to-Coast Forest: The plan is for 50 million new trees to repopulate one of the least wooded parts of the country—and offer a natural escape from several cities in the north.,24202,,771,Futurology
277,"The Future of Jobs: Working on Being Human - ""If only few man-hours will be necessary to maintain the machines, what will human beings do? They will be busy “being human,” which means developing themselves, their families, their societies and all that makes us human rather than robots.""",24154,,2964,Futurology
278,China Wants to Build a $50 Trillion Global Wind &amp; Solar Power Grid by 2050,24040,,1874,Futurology
279,Elon Musk: Automation Will Force Universal Basic Income,23974,,5017,Futurology
280,"FCC granted Elon Musk’s SpaceX permission to launch 4,425 satellites that will provide affordable high speed broadband internet to consumers. Facebook, Google and Microsoft all have similar projects underway. But these companies aren’t obligated to operate in the interest of consumers.",23947,,1747,Futurology
281,Exxon Is Spending $1 Billion a Year to Research Green Energy - “One of the world’s biggest oil companies is pumping more than $1 billion a year into alternative forms of energy from algae engineered to bloom into biofuels and cells that turn emissions into electricity.”,23911,,1535,Futurology
282,Forward Labs' new solar roof is 33% cheaper than Tesla's - and it can be installed in half the time,23915,,1275,Futurology
283,Oil industry is finally starting to be affected by Norway’s rapid electric car adoption,23909,,929,Futurology
284,We should all be working a four-day week.,23878,,1580,Futurology
285,Man lives 555 days with no heart in his body while thriving on a heart machine he carried in a backpack,23826,,1840,Futurology
286,"Bill and Melinda Gates think a weaponized disease may be the biggest threat to humanity - “A bioterrorist event could spread so quickly, and we are so unprepared for it”",23804,,1615,Futurology
287,"Andrew Yang is running for President to save America from the robots - Yang outlines his radical policy agenda, which focuses on Universal Basic Income and includes a “freedom dividend.”",23747,,2558,Futurology
288,We’re probably underestimating how quickly electric vehicles will disrupt the oil market,23593,,4002,Futurology
289,Al Gore offers to work with Trump on climate change.,23582,,2704,Futurology
290,"An aerosol to cool the Earth. Harvard researchers have identified an aerosol that in theory could be injected into the stratosphere to cool the planet from greenhouse gases, while also repairing ozone damage.",23564,,2785,Futurology
291,New Zealand bans all new offshore oil exploration as part of 'carbon-neutral future' - “committing to transition to 100% of electricity generation from renewable sources by 2035 and making the economy carbon neutral by 2050.”,23481,,1063,Futurology
292,"Wind power reaches 100K job milestone - "" (it) now employs more workers than nuclear, natural gas, coal, or hydroelectric power plants.""",23469,,1296,Futurology
293,"Starbucks announced on Monday it plans to eliminate plastic straws from its 28,000 stores worldwide by 2020.",23379,,1332,Futurology
294,A 25-year-old student has just come up with a way to fight drug-resistant superbugs without antibiotics,23267,,1581,Futurology
295,"Brooklyn’s Latest Craze: Making Your Own Electric Grid - Using the same technology that makes Bitcoin possible, neighbors are buying and selling renewable energy to each other.",23206,,1285,Futurology
296,Amazon’s facial recognition matched 28 members of Congress to criminal mugshots,23173,,829,Futurology
297,China and Europe to build a base on the moon and launch other projects into space - If space is to be explored peacefully it will require 'international collaboration' a spokesperson for the European Space Agency said,23109,,1546,Futurology
298,"Kids are taking the feds -- and possibly Trump -- to court over climate change: ""[His] actions will place the youth of America, as well as future generations, at irreversible, severe risk to the most devastating consequences of global warming.""",23110,,2727,Futurology
299,"We’re fighting the wrong trade battle with China. The future is clean energy - Global investments in renewables pass $2 trillion since 2010, with China in the lead by far",23080,,1800,Futurology
300,"Shell Plans to Spend $1 Billion a Year on Clean Energy by 2020 - CEO says shift to renewables, electric cars is accelerating",22986,,1146,Futurology
301,Elon Musk’s Boring Co. Wins Chicago Airport High-Speed Train Bid,22973,,1259,Futurology
302,McDonald’s Response to $15 Minimum Wage: Automation in Every Store,22947,,8821,Futurology
303,"Israel aims to eliminate use of coal, gasoline and diesel by 2030",22918,,1486,Futurology
304,"New York Health Officials See Marijuana as an Alternative to Opioids - New York should legalize recreational marijuana to temper the harm of opioid addiction, end racial disparity in enforcement and boost tax revenue, state health officials said.",22894,,649,Futurology
305,"These ""Smart Glasses"" Adjust To Your Vision Automatically - The glasses' liquid lenses change shape according to the distance of objects, making reading glasses and bifocals unnecessary",22892,,1114,Futurology
306,"China is expected to overfulfill its goals of cutting greenhouse gas emissions by 2020, which will lay a foundation for achieving its 2030 goals",22812,,1108,Futurology
307,"Paris is getting a 'White Forest' wooden tower that will feature 2,000 plants - It will feature residential units, offices, and retail.",22809,,735,Futurology
308,Electric cars exceed 1m in Europe as sales soar by more than 40%,22784,,1121,Futurology
309,Amazon could disrupt US healthcare by converting a standardized healthcare interface for its employees into a marketplace for individuals and other employers,22756,,1810,Futurology
310,"Rats with spinal cord injuries have regained the use of their paws after being given a groundbreaking gene therapy that helps to mend damaged nerves in the spine, by producing an enzyme called chondroitinase which breaks down scar tissue, as reported in a new study in the journal Brain.",22690,,705,Futurology
311,Bill Gates: “Consider a world where the age-old scourge of malaria is finally eradicated . . . where hundreds of millions of people no longer suffer from tuberculosis . . . and where we have a cure for HIV.”,22603,,2151,Futurology
312,"In a new world record, scientists at IBM have captured 330 terabytes of uncompressed data — or the equivalent of 330 million books — into a cartridge that can fit into the palm of your hand.",22586,,1130,Futurology
313,Drones keep dropping drugs and porn into prisons,22579,,1254,Futurology
314,"Nation's longest bike path will connect Maine to Florida: The East Coast Greenway will stretch from Calais, Maine, to Key West, Florida, a 2,900-mile distance. The project will provide non-motorized users a unique way to travel up and down the East Coast through 25 cities and 16 states.",22582,,1378,Futurology
315,Taiwan to ban disposable plastic items by 2030,22570,,557,Futurology
316,Elon Musk shows test run of The Boring Company's electric slide,22469,,2368,Futurology
317,"AI-driven unemployment in Hong Kong can be offset by a tax on profits generated by robots - Taken to another level, taxes on businesses can also be used to fund a universal basic income",22430,,2098,Futurology
318,Tesla battery researcher says they doubled lifetime of batteries in Tesla’s products 4 years ahead of time,22356,,864,Futurology
319,​South Korea's internet provider SK Broadband rolls out 2.5Gbps internet using using Gigabit-Passive Optical Network (GPON) technology; will roll out 5Gbps and 10Gbps internet services in the second half of the year. Current coverage is 40% but it aims to expand this to 80% by 2020.,22355,,2290,Futurology
320,"Plans for coal-fired power plants drop by almost half in 2016 - ""the shift from fossil fuels to clean sources in the power sector is a positive one for health, climate security, and jobs. And by all indications, the shift is unstoppable.""",22357,,1056,Futurology
321,"The startup behind Silicon Valley’s favorite ‘bleeding’ veggie burger has scored a major victory in its battle for legitimacy - On Monday, the FDA gave Impossible Foods the official green light that heme is safe to eat.",22278,,2142,Futurology
322,"A Newly Discoverd Mineral Can Convert Movement, Sunlight and Heat Into Electricity at the Same Time",22281,,648,Futurology
323,"Self-repairing organs could save your life in a heartbeat. Rather than growing cells in a dish and transplanting them, researchers want to switch Lab-grown stem cells inside the body, so that we can heal ourselves from within",22269,,509,Futurology
324,SpaceX successfully lands its rocket on a floating drone ship for the first time,22187,,863,Futurology
325,"Russia will beat NASA to Mars and find water in the Moon, says Putin: ""We are planning unmanned and later manned launches, into deep space, as part of a lunar program and for Mars exploration. The closest mission is very soon, we are planning to launch a mission to Mars in 2019.""",22183,,2341,Futurology
326,"Beef companies file petition against lab-grown meat startups - The US Cattlemen's Association (USCA) has filed a petition to the USDA arguing that lab-grown meat startups should not be able to call their products ""meat,"" since they do not come from slaughtered animals.",22186,,3633,Futurology
327,"The Hyperloop Industry Could Make Boring Old Trains and Planes Faster and Comfier - “The good news is that, even if hyperloop never takes over, the engineering work going on now could produce tools and techniques to improve existing industries.”",22163,,1599,Futurology
328,Graphene-Fed Silkworms Produce a Super-Strong Silk That Conducts Electricity,22129,,746,Futurology
329,"Even when all teenagers, rich and poor, have equal access to the internet, a “digital divide” remains in how they use technology. Richer teenagers are more likely to use the internet to search for information or to read news rather than to chat or play video games.",22082,,3633,Futurology
330,US President Says Windmills Are Bird Killers As He Tries to Revive Coal Industry,22051,,2287,Futurology
331,Nanobots kill off cancerous tumors,21999,,727,Futurology
332,"'Killer robots' that can decide whether people live or die must be banned, warn hundreds of experts: 'These will be weapons of mass destruction. One programmer will be able to control a whole army'",21997,,1657,Futurology
333,"""A biotech company in the US has been granted ethical permission to recruit 20 patients who have been declared clinically dead from a traumatic brain injury, to test whether parts of their central nervous system can be brought back to life.""",21944,,1653,Futurology
334,"The North Pole is 36 degrees hotter than it should be right now: ""related to climate change around the rest of the planet""",21881,,3014,Futurology
335,Can we remove a trillion tons of carbon from the atmosphere? Ocean ecologist Russ George explains how ocean restoration will lower greenhouse gases and bring back fish stocks to levels not seen for generations,21811,,621,Futurology
336,"Dirty energy's quiet war on solar panels - ""there's a growing movement by industry front groups to undermine net metering and other renewable energy incentives.""",21770,,1075,Futurology
337,Every childhood vaccine may go into a single jab - one-shot solution stores the vaccine in microscopic capsules that release the initial dose and then boosters at specific times.,21732,,1085,Futurology
338,"Scientists just invented a smartphone screen material that can repair its own scratches - ""After they tore the material in half, it automatically stitched itself back together in under 24 hours""",21675,,1055,Futurology
339,China reminds Trump that supercomputing is a race,21557,,3145,Futurology
340,Microplastics in our mussels: the sea is feeding human garbage back to us. A new report found that seafood contains an alarming amount of plastic – and in fact no sea creature is immune. It’s as if the ocean is wreaking its revenge,21536,,899,Futurology
341,"Solar power at 1¢/kWh by 2025 - ""The promise of quasi-infinite and free energy is here""",21500,,2828,Futurology
342,"Silicon Valley billionaire Stewart Butterfield voices support for universal basic income - The founder of Slack joins illustrious company which includes Bill Gates, Elon Musk, and Mark Zuckerberg",21503,,3061,Futurology
343,India’s Prime Minister has pledged to eliminate all single-use plastic in the country by 2022 with an immediate ban in urban Delhi.,21491,,843,Futurology
344,"Elon Musk has SpaceX, now Ray Dalio has OceanX — and he says it’s more exciting: OceanX “will enable explorers and researchers to explore the unseen ocean, map uncharted areas of the world, observe rare deep-sea creatures and pursue scientific and medical breakthroughs“",21459,,807,Futurology
345,"How Elon Musk's A.I. Destroyed The World's Best Gamers in ""DoTA 2' - It took them just 6 months: “Instead of trying to program the perfect bot, OpenAI just created a bot that learned through trial and error.”",21425,,1410,Futurology
346,"Human corneas have been 3D printed for the first time. Stem cells from a healthy donor cornea were mixed with alginate, a gel derived from seaweed, and collagen to create a “bio-ink”. Using a 3D printer, this bio-ink was extruded into concentric circles to form an artificial cornea.",21393,,396,Futurology
347,"Scientists have figured out a way to make diamonds in a microwave — and it could change the diamond industry: It's estimated that by 2026, the number of lab-made diamonds will skyrocket to 20 million carats.",21364,,1760,Futurology
348,Bill Gates thinks an infectious disease outbreak could kill 30 million people in the next decade — but the US is cutting efforts to prevent global pandemics,21337,,1531,Futurology
349,"Dan Rather: Now, More Than Ever, We Must Stand Up for Science",21331,,1678,Futurology
350,"Tesla Plans To Build Entire City, Possibly Hundreds Of #TeslaCities",21304,,1378,Futurology
351,The Cost of Solar Power Has Fallen 25% in Only 5 Months,21261,,1186,Futurology
352,A small Swiss company is developing technology to suck carbon dioxide out of the air — and it just won $31 million in new investment. The company uses high-tech filters and fans to extract carbon dioxide from the atmosphere at a cost of about $600 a ton.,21245,,1432,Futurology
353,Data is the new lifeblood of capitalism – don't hand corporate America control. Data has become the world’s most important resource. Now Silicon Valley giants want to keep government from standing in the way of profits,21230,,1365,Futurology
354,Uber Self-Driving Truck Packed With Budweiser Makes First Delivery in Colorado,21213,,2735,Futurology
355,Google says it is on track to definitively prove it has a quantum computer in a few months’ time,21211,,1566,Futurology
356,"There's a compelling reason scientists think we've never found aliens, and it suggests humans are already going extinct - ""civilizations might emerge and develop and burn themselves up simply too fast to ever find one another.""",21205,,2383,Futurology
357,Is the future of Hemp going up in smoke? DEA declares industrial Hemp schedule 1 drug. HIA fights back with lawsuit.,21183,,2261,Futurology
358,"A Few Billionaires Are Turning Medical Philanthropy on Its Head - scientists must pledge to collaborate instead of compete and to concentrate on making drugs rather than publishing papers. What’s more, marketable discoveries will be group affairs, with collaborative licensing deals.",21104,,949,Futurology
359,"Studies are increasingly clear: Uber, Lyft congest cities - “ride-hailing companies are pulling riders off buses, subways, bicycles and their own feet and putting them in cars instead.”",21036,,2443,Futurology
360,Hawaii just passed a law to make the state carbon neutral by 2045 - The plan is the most ambitious emissions reduction and renewable energy plan of any state in the country.,21020,,881,Futurology
361,"Renewable energy set to be cheaper than fossil fuels by 2020, according to new report",20983,,794,Futurology
362,Finland set to become first country to ban coal use for energy,20960,,857,Futurology
363,"Stimulating the prefrontal cortex reduced a person’s intention to commit a violent act by more than 50%, and increased the perception that acts of physical and sexual assault were morally wrong, finds new randomized, double-blind, placebo-controlled trial of transcranial direct-current stimulation.",20961,,1369,Futurology
364,"Feeding cows seaweed could slash global greenhouse gas emissions, researchers say: ""They discovered adding a small amount of dried seaweed to a cow's diet can reduce the amount of methane a cow produces by up to 99 per cent.""",20931,,1199,Futurology
365,"Psychedelic drugs appear to fundamentally reorganize the brain — and they're starting to turn into approved treatments. Illicit drugs like mushrooms, ecstasy, and ketamine are inspiring a range of potential treatments for diseases that currently lack good medications.",20911,,1583,Futurology
366,Paralyzed man regains use of arms and hands after experimental stem cell therapy,20899,,867,Futurology
367,"Microwave breakthrough helps boost hard drive sizes - The data-storing abilities of hard drives could soon swell to 40 terabytes (TB) and beyond, says Western Digital.",20825,,1364,Futurology
368,"Chernobyl's new sarcophagus took two decades to make. Bigger than Wembley Stadium and taller than the Statue of Liberty, it will seal in the entire disaster site for 100 years",20834,,1618,Futurology
369,US Defence Secretary James Mattis says climate change is already destabilising the world,20818,,1539,Futurology
370,"Japan is building the World’s largest floating solar power plant - ""The 13.7 megawatt (MW) floating solar power plant will be built on the Yamakura Dam reservoir.""",20811,,897,Futurology
371,Solar panels have dropped 80% in cost since 2010 - Solar power is now reshaping energy production in the developing world,20793,,1574,Futurology
372,"World's poorest countries to aim for 100% green energy: ""Representatives from 47 of the world's most disadvantaged nations have pledged to generate all their future energy needs from renewables.""",20733,,891,Futurology
373,A self-driving Uber killed a pedestrian. Human drivers will kill 16 today.,20714,,3693,Futurology
374,"Australia is currently experiencing an unprecedented boom in solar and wind energy investments, both in terms of capacity and dollars. It will likely take the country to a 33% share of renewables as early as 2020.",20705,,805,Futurology
375,"Psychedelic drugs could tackle depression in a way that antidepressants can't - ""Researchers say the drugs' apparent ability to induce powerful, positive changes in personality could offer a way to address the foundations of mental illness""",20678,,1684,Futurology
376,U.S. states vow to fight government proposal to weaken fuel efficiency standards.,20557,,1590,Futurology
377,"Microsoft “AI For Earth” Project - $50 million over the next 5 years to democratize access to the climate change data available about the environment available from the thousands of land, sea, and atmospheric sensors in place around the world using AI or artificial intelligence.",20551,,734,Futurology
378,"First Tesla Solar Roof Is Here, and It Looks Amazing",20502,,1900,Futurology
379,Artificial intelligence system detects often-missed cancer tumors,20509,,320,Futurology
