,title,ups,selftext,num_comments,subreddit
666,AlphaZero AI beats champion chess program after teaching itself in four hours,13866,,1504,Futurology
667,"The driverless truck is coming, and it’s going to automate millions of jobs",13857,,4127,Futurology
668,"The lab-grown food industry is now lobbying in Washington: ""The Good Food Institute represents the interests of the clean (think burgers made without slaughtering cows) and plant-based food industries, many of which are working on the cutting edge of food technology.""",13861,,1852,Futurology
669,People in a new study struggled to turn off a robot when it begged them not to: 'I somehow felt sorry for him',13855,,1094,Futurology
670,"The 8 Minute Surgery That Will Give You Superhuman Vision - Forever: a new bionic eye lens currently in development would give humans 3x 20/20 vision, at any age.",13844,,2031,Futurology
671,"AI cyberattacks will be almost impossible for humans to stop - As cyberattacks become more refined, they will start mimicking our online traits. This will lead to a battle of the machines",13799,,625,Futurology
672,Elon Musk: A Million Humans Could Live on Mars By the 2060s,13791,,3532,Futurology
673,Goodbye Human Translators - Google Has A Neural Network That is Within Striking Distance of Human-Level Translation,13792,,1565,Futurology
674,Google files patent for cyborg eye lenses,13782,,817,Futurology
675,How to Feed Ten Billion: Lab-Made 'Clean Meat' Burgers are Future of Food,13766,,3398,Futurology
676,Millennials Born In 1980s May Never Recover From The Great Recession,13765,,3938,Futurology
677,A bot wrote a new Harry Potter chapter and it's delightfully hilarious,13743,,926,Futurology
678,Netherlands looks to ban all non-electric cars by 2025,13736,,1526,Futurology
679,"Autonomous cars are ‘the vaccine that will cure deaths on the road’, says industry figurehead - ""For each day that we can accelerate connected and autonomous vehicles, we will save 3300 people a day.""",13724,,2606,Futurology
680,Scotland ‘on target’ for 100% renewable energy by 2020,13728,,404,Futurology
681,"St. Petersberg, Florida has committed to switching its power sources over to 100 percent renewable energy—the first city in the Sunshine State to pledge to do away with fossil fuels entirely.",13714,,707,Futurology
682,"City tree - a moss culture with the environmental benefit of up to 275 actual trees that removes dust, nitrogen dioxide and ozone gases from the air. The installation is autonomous with solar panels for electricity, while rainwater is collected into a reservoir and then pumped into the soil.",13712,,858,Futurology
683,"This Week In Science - September 1, 2017",13682,,435,Futurology
684,"Your iPhone Has a Password, Shouldn't Your Pistol?: MIT freshman Kai Kloepfer is developing smart-gun technology that could save thousands of lives, so why are critics blocking it?",13690,,4650,Futurology
685,The End of Meaningless Jobs Will Unleash the World's Creativity,13680,,5054,Futurology
686,No country on Earth is taking the 2 degree climate target seriously: we are betting our collective future on being able to bury millions of tons of carbon. It’s a huge and existentially risky bet — and maybe one out of a million people even know it’s being made.,13671,,1979,Futurology
687,EV battery that reaches full charge in 5 minutes looking to become commercial in 3 years.,13646,,1207,Futurology
688,World’s First Colored Human X-Ray Applies CERN Technology Used In Search Of ‘God Particle’,13630,,393,Futurology
689,The FDA has approved the first digital pill - The pill is fitted with a tiny ingestible sensor that communicates with a patch worn by the patient — the patch then transmits medication data to smartphone app which the patient can voluntarily upload to a database for their doctor.,13620,,483,Futurology
690,Scientists find key to regenerating blood vessels,13610,,213,Futurology
691,VW announces massive $84 billion investment in electric cars and batteries,13569,,819,Futurology
692,"M&amp;Ms are going to promote wind power in a new TV ad campaign - Mars has built two massive wind farms in Scotland and Texas... plans to build similar wind farms in 11 more major markets around the world, such as Russia and India.",13537,,453,Futurology
693,"Panasonic to invest over $256 mln in Tesla's U.S. plant for solar cells - ""In a joint statement on Tuesday, the two companies said they plan to start production of PV modules in the summer of 2017 and increase to one gigawatt of module production by 2019.""",13524,,694,Futurology
694,"Stephen Hawking Says We Should Really Be Scared Of Capitalism, Not Robots: ""If machines produce everything we need, the outcome will depend on how things are distributed.""",13516,,3409,Futurology
695,"Sir Richard Branson to blast himself into space 'in months' after training as an astronaut: 'We're talking about months not years - so it's close. There are exciting times ahead,' says billionaire entrepeneur",13478,,579,Futurology
696,We are now witnessing Elon Musks slow-motion disruption of the global auto industry,13487,,2422,Futurology
697,Universal Basic Income: Why Elon Musk Thinks It May Be The Future - “There will be fewer and fewer jobs that a robot cannot do better.”,13476,,1896,Futurology
698,"SpaceX Chief Elon Musk Will Explain Next Week How He Wants to ""Make Humans a Multiplanetary Species""",13470,,1402,Futurology
699,"Wyoming embraces wind energy, and the jobs that come with it - ""Wind turbine jobs are expected to be the fastest growing jobs in America between now and 2024, growing 108%.""",13458,,784,Futurology
700,NVIDIA AI Car Demonstration: Unlike Google/Tesla - their car has learnt to drive purely from observing human drivers and is successful in all driving conditions.,13465,,1717,Futurology
701,"New eyedrops could repair corneas, make glasses unnecessary",13450,,423,Futurology
702,"Universal basic income: U.S. support grows as Finland ends its trial - Forty-eight percent of Americans now support a universal basic income, as a solution for Americans who have lost jobs to automation.",13426,,2754,Futurology
703,Massive new data set suggests economic inequality is about to get even worse...,13425,,2667,Futurology
704,Walmart Just Patented Audio Surveillance Technology For Listening In On Employees,13390,,1368,Futurology
705,Why Richard Branson and Bill Gates Are Betting Big on a Food Startup You've Never Heard Of - The Virgin mogul believes clean meat could be one of the keys to defeating climate change.,13372,,933,Futurology
706,"FCC Rules you can get cable through Apple, Google, Amazon, and Android",13369,,1215,Futurology
707,"Chinese robot becomes world's first machine to pass medical exam - A robot has passed the written test of China's national medical licensing examination, an essential entrance exam for doctors",13360,,919,Futurology
708,"NEW DELHI: The government is working on a scheme to provide electric cars on zero down payment for which people can pay out of their savings on expensive fossil fuels, for becoming 100 per cent electric vehicle nation by 2030",13345,,1295,Futurology
709,"Conservationists trying to restore the US’s grasslands keep running into a problem: As soon as they plant the seeds, hungry mice gobble them up. So now the researchers are coating the seeds with capsaicin, the active spice in ghost peppers. And it is working really well.",13324,,498,Futurology
710,"Former employees of Google, Apple, Tesla, Cruise Automation, and others — 40 people in total — have formed a new San Francisco-based company called Otto with the goal of turning commercial trucks into self-driving freight haulers",13326,,2891,Futurology
711,Newly Developed Nanotech 'Super Sponge' Removes Mercury from Water in Less Than 5 Seconds Which Could Make Effective Toxic Cleanup of Lakes Possible in the Future,13283,,259,Futurology
712,What it's really like to work in Amazon's warehouse - draining and depressing - Undercover at Amazon: Exhausted humans are inefficient so robots are taking over,13272,,2049,Futurology
713,Barack Obama says Democrats need to get smarter about tech taking jobs,13270,,1675,Futurology
714,The White House administration wants to loosen protections for endangered species while scientists brace for mass die-offs to accelerate globally.,13267,,990,Futurology
715,Universal antibody drug for HIV-1 prevention and immunotherapy: Tandem bi-specific broadly neutralizing antibody is universally effective not only against all genetically divergent global HIV-1 strains tested but also promoted the elimination of latently infected cells in a humanized mouse model.,13264,,362,Futurology
716,Memory That Lasts Forever: New Quartz Coin Can Store 360TB of Data for 14 Billion Years,13248,,1469,Futurology
717,"When it comes to America and marijuana, we are “careening from treating cannabis as if it were as dangerous as heroin to treating it as if it were as benign as kombucha”.",13246,,2030,Futurology
718,"Coal Mining Jobs Trump Would Bring Back No Longer Exist - ...in order to stay competitive, coal will have to increase automation,” he said. “What Mr. Trump does will make little difference.”",13218,,1350,Futurology
719,Herzog illuminates something: the internet is a biblical awakening. It is next stage human evolution. Which is why the internet must stay open.,13217,,474,Futurology
720,"A 100% renewable grid isn’t just feasible, it’s already happening - there are seven countries already at, or very, near 100 percent renewable power: Iceland (100 percent), Paraguay (100), Costa Rica (99), Norway (98.5), Austria (80), Brazil (75), and Denmark (69.4).",13172,,820,Futurology
721,"MDMA-assisted psychotherapy for PTSD causes long-lasting changes in personality, study finds - ""using a double blinded, placebo controlled, open label, cross-over design with long-term follow-up... we have found that 67.4% of subjects no longer met the DSM criteria for PTSD""",13149,,617,Futurology
722,"Switching to electric cars is key to fixing America's 'critically insufficient' climate policies - Nearly 60% of US carbon pollution comes from power and transportation, and power is already decarbonizing fast",13129,,1558,Futurology
723,Tesla Wins Massive Contract to Help Power the California Grid,13122,,918,Futurology
724,SpaceX makes aerospace history with successful landing of a used rocket - The Verge,13118,,393,Futurology
725,Dubai wants 25% of its police force to be robotic by 2030,13097,,1248,Futurology
726,Ireland votes to stop investing public money in fossil fuels - It'd be the the first country to officially cut ties with coal and oil.,13059,,259,Futurology
727,"Hawaii Eyes Offshore Wind to Reach its 100 Percent Clean Energy Goal | Under a 2013 law, the state's utilities must generate 100 percent of their electricity from renewable energy resources by 2045, the most aggressive goal in the country.",13062,,1011,Futurology
728,All Volvo models to become electrified from 2019,13052,,850,Futurology
729,India to make every single car electric by 2030 in bid to tackle pollution that kills millions,13041,,855,Futurology
730,"The United Nations is on the verge of calling for governments around the world to end the “war on drugs” by decriminalizing the use and possession of illicit narcotics, according to businessman Sir Richard Branson.",13015,,1213,Futurology
731,"End of coal: Failure to see it coming will hurt miners most - ""Workers must prepare for and move to new jobs, regional economic policy has to be redrawn and companies need to develop new business models.""",12973,,1464,Futurology
732,"Natural selection making 'education genes' rarer, says Icelandic study - Researchers say that while the effect corresponds to a small drop in IQ per decade, over centuries the impact could be profound",12952,,3029,Futurology
733,New blockchain-based decentralized internet being built by Princeton-trained computer scientists,12952,,1148,Futurology
734,"India has come one step closer to achieving an unlimited source of energy, by commissioning Nuclear fast-breeder reactor at Kalpakkam, it has found use for its vast reserves of Thorium.",12917,,1047,Futurology
735,Germany's largest Bank says a form of Basic Income may be needed to keep the global economy growing,12898,,2969,Futurology
736,Elon Musk has started digging a giant underground tunnel in LA,12876,,1598,Futurology
737,"UK government recently passed the Space Industry Bill, as it laid regulatory groundwork that will be needed to create an operational spaceport, potentially by 2020. UK also set to create world’s first fully commercial astronaut training ground, with construction expected to start later this year.",12834,,638,Futurology
738,Google's AI created its own form of encryption,12829,,1245,Futurology
739,Cable TV Revenue to Drop by $2.7 Billion in Next 10 Years,12819,,1331,Futurology
740,Old Mice Made Young Again With New Anti-Aging Drug,12780,,1146,Futurology
741,"Google Robot factory raises sterile mosquitos, automated device will release a million per week",12779,,1696,Futurology
742,Twitter taught Microsoft’s AI chatbot to be a racist asshole in less than a day,12780,,1840,Futurology
743,NASA Considers Magnetic Shield to Help Mars Grow Its Atmosphere,12766,,1263,Futurology
744,"Mark Zuckerberg: “it’s time for our generation to define a new social contract” | Zuckerberg suggested universal basic income, affordable childcare, flexible healthcare, prison reform, and continuous education as the ways to provide this equal opportunity.",12765,,2010,Futurology
745,"CRISPR gene editing starts to save lives as human trials get under way - by the end of 2017, the technique could have saved dozens of lives.",12739,,961,Futurology
746,"Plants have been ""hijacked"" to make polio vaccine in a breakthrough with the potential to transform vaccine manufacture, say scientists.",12718,,458,Futurology
747,Your future employer will buy your internet data to inspect your productivity,12701,,1410,Futurology
748,2016 was the year solar panels finally became cheaper than fossil fuels. Just wait for 2017,12688,,773,Futurology
749,MIT neuroscientists have developed a new magnetic resonance imaging (MRI) sensor that allows them to monitor neural activity deep within the brain by tracking calcium ions. This could allow researchers to link specific brain functions to their pattern of neuron activity,12659,,170,Futurology
750,Texas Got 18 Percent of Its Energy from Wind and Solar Last Year - For years critics have claimed grid costs and stability will spiral out of control before we hit 20 percent renewable energy. Texas is proving them wrong,12651,,530,Futurology
751,"Tesla puts pedal to the metal, 500,000 cars planned in 2018",12652,,1382,Futurology
752,Why we should fear a cashless world: Poor people and small businesses rely on cash. A contactless system will likely entrench poverty and pave the way for terrifying levels of surveillance,12632,,2455,Futurology
753,"Elon Musk scales up his ambitions, considering going “well beyond” Mars",12626,,1774,Futurology
754,SpaceX lands another one of its Falcon 9 rockets on solid ground: The six rockets that have attempted land landings have all touched down just fine,12603,,279,Futurology
755,U.S. and Russian Scientists Are Making Plans to Go Back to the Moon Together,12502,,920,Futurology
756,"Big money is backing out of fossil fuel industry, moving into greener alternatives - “follow the dollar to see where the future of energy is headed, globally.”",12488,,548,Futurology
757,"Senate panel authorizes money for Mars mission, shuttle replacement",12480,,657,Futurology
758,Tesla Powerpacks aid Samoa’s transition to 100% renewable energy - would ultimately allow Samoa to power itself on 100% renewable energy by 2025.,12472,,297,Futurology
759,Engineers Have Created Biocompatible Microrobots That Can be Implanted Into the Human Body,12459,,1032,Futurology
760,"Police body camera footage is becoming a state secret -- North Carolina, Louisiana, Kansas, and other states are writing laws to keep police videos out of public hands",12421,,1359,Futurology
761,Canada produces 66% of its electricity from renewables - Country produces 10 per cent of the world's hydro-electricity,12350,,1315,Futurology
762,AIs have replaced aliens as our greatest world-destroying fear,12323,,818,Futurology
763,"""Fusion Is Always 50 Years Away"" For A Reason",12289,,1577,Futurology
764,"Googly-Eyed Trash Eaters May Clean a Harbor Near You - ""solar- and hydro-powered trash interceptors... Over a million pounds of trash has been pulled out of the water... since it was installed in May 2014.""",12286,,501,Futurology
765,Artificial intelligence researchers taught an AI to decide who a self-driving car should kill by feeding it millions of human survey responses,12259,,2436,Futurology
766,Elon Musk plans launch of 4000 satellites to bring Wi-Fi to most remote locations on Earth,12259,,1581,Futurology
767,"Scientists Found a Way to Stop Aging in Human Cells - ""team used a technology called RNA therapeutics, which delivers RNA directly into cells, to spur cells to produce telomerase, a protein that lengthens telomeres.""",12240,,1073,Futurology
768,"Through DARPA, a 28 year old paralyzed man has become the first person to feel physical sensations through a prosthetic hand directly connected to his brain",12223,,799,Futurology
769,"Kimbal Musk -- Elon's brother -- looks to revolutionize urban farming: Square Roots urban farming has the equivalent of acres of land packed inside a few storage containers in a Brooklyn parking lot. They're hydroponic, which means the crops grow in a nutrient-laced water solution, not soil.",12190,,554,Futurology
770,"Scientists discover the first ever safe way to send medication into the placenta during pregnancy, which could eliminate premature births in the future",12188,,299,Futurology
771,Elon Musk warns Australia on its energy supply problems - Elon Musk says Australia needs to fix its energy supply problems urgently or it risks being plunged into “the dark ages”.,12166,,1179,Futurology
772,"Commerce Secretary Wilbur Ross: If we don't use robots, everyone else will - ""The right solution is to properly equip the American workforce, not to try to hold back technology""",12157,,1279,Futurology
773,Cornea cells 'successfully' grown and implanted to cure blindness,12155,,268,Futurology
774,"Epilepsy patients turning to medicinal cannabis, survey shows - Study reports 14% of people with epilepsy used cannabis products to manage condition, with large majority reporting improvements",12143,,587,Futurology
775,"Mods are busy time traveling, post old timey things??",12104,,167,Futurology
776,"Scientists developed a new surgical technique to reconnect sensory neurons to the spinal cord after traumatic spinal injuries, recreating it in rats successfully with offshoots from the spinal cord growing into the implanted sensory neurons to complete a spinal circuit at a cellular level.",12046,,357,Futurology
777,Let's Turn America's Military-Industrial Complex into a Science-Industrial Complex,12034,,1333,Futurology
778,Scientists in Japan now have permission to treat people who have heart disease with tissue derived from human induced pluripotent stem cells. Sheets of up to 100 million heart muscle cells grown in a lab will be surgically applied to diseased hearts.,12030,,351,Futurology
779,"Forests are spreading in the rich world: for example, in 1990 28% of Spain was forested; now the proportion is 37%",12016,,700,Futurology
780,Google is getting serious about its plan to wire the US with superfast internet,12008,,1489,Futurology
781,Exoskeletons won’t turn assembly line workers into Iron Man - But they'll feel better at the end of the day.,11995,,416,Futurology
782,"A basic income for everyone? Yes, Finland shows it really can work - Mark Zuckerberg, Bernie Sanders and Elon Musk back the idea. And trials suggest it can liberate jobless people from a life of humiliation",11948,,3134,Futurology
783,SpaceX plans to send a spacecraft to Mars as early as 2018,11943,,953,Futurology
784,What Happened to Green Concrete? Concrete that absorbs carbon dioxide has made slow progress but is finally hitting the market.,11945,,363,Futurology
785,"Australian surfers invent Seabin, a rubbish bin for the ocean",11942,,334,Futurology
786,"Spain aiming for 100 per cent renewable energy: ""Enough wind energy is being generated in Spain to power more than 29 million homes every day, according to one of the country's biggest renewable energy companies.""",11922,,567,Futurology
787,Fighter jets with lasers will become a reality in 2021,11915,,1041,Futurology
788,"An AI system at Houston Methodist Hospital read breast X-rays 30x faster than doctors, with 20% greater accuracy.",11887,,529,Futurology
789,"iPhone manufacturer Foxconn is replacing 60,000 workers with robots",11884,,3147,Futurology
790,Low-Cost Soft Robot Muscles Can Lift 200 Times Their Weight and Self-Heal,11860,,394,Futurology
791,"FCC approves SpaceX plan for 4,425-satellite broadband network",11849,,943,Futurology
792,The ‘just walk out technology’ of Amazon Go makes queuing in front of cashiers obsolete,11810,,3380,Futurology
793,What Saved Hostess And Twinkies: Automation And Firing 95% Of The Union Workforce,11796,,3556,Futurology
794,"I am Frank Drake, creator of the Drake Equation and I helped design the Pioneer Plaque and Golden Record with Carl Sagan. AMA. • r/space",11781,,13,Futurology
795,"Saudi Arabia recently announced plans for a $500 billion techutopia mega-city Neom, with 100% solar energy, fully autonomous transportation, hydroponic farms, artificial intelligence, and advanced manufacturing, open to all races and religions - a “new civilization.”",11774,,952,Futurology
796,Mark Zuckerberg doubles down on universal basic income after a trip to Alaska,11768,,2551,Futurology
797,"Engineers develop state-by-state plan to convert US to 100% clean, renewable energy by 2050",11770,,1597,Futurology
798,"A non-opioid, experimental drug called EMA401 has shown promise as a treatment for chronic nerve pain in a new study in mice. It targets receptors on immune cells called macrophages, instead of nerves, and it doesn’t cross the blood-brain barrier, so it eliminates side effects such as addiction.",11760,,474,Futurology
799,"Biological terrorism could kill more people than nuclear attacks, Bill Gates to warn world leaders - ""Rapid advances in genetic engineering have opened the door for small terrorism groups to tailor and easily weaponise disease viruses.""",11749,,783,Futurology
800,"An exhaustive federal study of Canada’s largest national park concludes almost every aspect of its environment is deteriorating. The 561-page report says industry, dams, climate change and natural cycles are sucking the watery lifeblood from the vast delta of rivers",11728,,376,Futurology
801,China to invest £292bn in renewable power by 2020 - World’s largest energy market looks to move from coal towards cleaner fuels,11733,,939,Futurology
802,"Nokia Reaches Internet Speeds 1,000 Times Faster Than Google's Fiber",11729,,1194,Futurology
803,"Stephen Hawking: If aliens call, we should be 'wary of answering'",11721,,2589,Futurology
804,"America is unprepared for the ""jobs apocalypse"" automation will bring",11709,,2475,Futurology
805,"Sex robot called Samantha 'who has brain and can tell jokes' goes on sale in UK for ÂŁ3,500",11716,,2289,Futurology
806,"Iowa Passes Plan to Convert to 100 Percent Renewable Energy. ""We are finalizing plans to begin construction of the 1,000 wind turbines, with completion expected by the end of 2019,""",11680,,838,Futurology
807,Tesla Overtakes GM as Top U.S. Automaker by Market Cap,11675,,707,Futurology
808,"Governments have to invest in the fourth industrial revolution - ""artificial intelligence, nanotechnology, biotechnology, materials science, 3D printing and quantum computing to transform the global economy.""",11642,,711,Futurology
809,Texan coal plant lays off 70 workers because the fossil fuel is not making money,11629,,631,Futurology
810,"World’s Biggest Vertical Farm Near NYC to Use 95% Less Water - AeroFarms is on track to produce 2 million pounds of food per year in its 70,000-square-foot facility in Newark, ""with yields 75 times higher per square foot annually"" than traditional agricultural approaches.",11625,,1312,Futurology
811,The world's first hydrogen-powered passenger train is coming to Germany,11601,,547,Futurology
812,"Scientists successfully developed a transgenic rice plant that expresses three different proteins that can stop HIV from entering human cells. The finding could lead to a less costly, easier way of producing prophylactics that could stop the spread of HIV, particularly in the developing world.",11596,,272,Futurology
813,Tube transport company says it has figured out a way to create a 'freeway' that can enable 'space travel on earth.' The CEO says that through these tubes you could travel from US to India in 3 hours for $50.,11599,,1508,Futurology
814,NASA is pioneering the development of tiny spacecraft made from a single silicon chip - calculations suggest that it could travel at one-fifth of the speed of light and reach the nearest stars in just 20 years. That’s one hundred times faster than a conventional spacecraft can offer.,11586,,991,Futurology
815,We could colonize the moon for just $10 billion — and make it happen by 2022,11574,,2158,Futurology
816,"Fish are migrating more than 40 miles per decade as the oceans heat up, pushing populations into fisheries where other countries have exclusive rights and setting the stage for an era of surging international conflict, new research has found",11563,,532,Futurology
